<?xml version="1.0" encoding="UTF-8"?>
<xsd:schema xmlns:xsd="http://www.w3.org/2001/XMLSchema" elementFormDefault="qualified" attributeFormDefault="unqualified">

<xsd:attributeGroup name="groupe_attributs_livre">
	<xsd:attribute name="isbn" type="xsd:string" use="required"/>
	<xsd:attribute name="categorie" type="xsd:string"/>
</xsd:attributeGroup>

<xsd:group name="groupe_elements_livre" >
	<xsd:sequence>
		<xsd:element name="titre" type="xsd:string" />
		<xsd:element name="auteur" type="xsd:string" 
			minOccurs="1" maxOccurs="unbounded" />
		<xsd:element name="editeur" type="xsd:string" />
	</xsd:sequence>
</xsd:group>

<xsd:complexType name="type_livre">
	<xsd:sequence>
		<xsd:group ref="groupe_elements_livre" />
	</xsd:sequence>
	<xsd:attributeGroup ref="groupe_attributs_livre" />
</xsd:complexType>

<xsd:complexType name="type_librairie" >
	<xsd:sequence>
		<xsd:element name ="livre" type="type_livre" 
		maxOccurs="unbounded"/>
	</xsd:sequence>
</xsd:complexType>	

<xsd:element name="librairie" type="type_librairie"/>

</xsd:schema>
